{
  "query": "text:(chickpea OR lentil OR bean) stew",
  "fields": null,
  "filters": [
    { "KeywordEq": { "field": "language", "value": "en" } },
    { "KeywordEq": { "field": "meal_type", "value": "dinner" } },
    { "I64Range": { "field": "servings", "min": 4, "max": 12 } },
    { "I64Range": { "field": "total_time_minutes", "min": 0, "max": 60 } }
  ],
  "limit": 5,
  "execution": "wand",
  "bmw_block_size": null,
  "return_stored": true,
  "highlight_field": "text"
}
