{
  "query": "text:(seafood fish lemon herbs) OR title:(seafood OR fish)",
  "fields": null,
  "filters": [
    { "KeywordEq": { "field": "language", "value": "en" } },
    { "KeywordEq": { "field": "region", "value": "Mediterranean" } },
    { "KeywordEq": { "field": "meal_type", "value": "dinner" } },
    { "I64Range": { "field": "total_time_minutes", "min": 0, "max": 45 } }
  ],
  "limit": 5,
  "execution": "wand",
  "bmw_block_size": null,
  "return_stored": true,
  "highlight_field": "text"
}
