{
  "query": "text:vegan",
  "fields": null,
  "filters": [
    {
      "KeywordEq": {
        "field": "language",
        "value": "en"
      }
    },
    {
      "KeywordEq": {
        "field": "meal_type",
        "value": "breakfast"
      }
    },
    {
      "KeywordEq": {
        "field": "dietary_tags",
        "value": "vegan"
      }
    },
    {
      "I64Range": {
        "field": "cook_time_minutes",
        "min": 0,
        "max": 25
      }
    }
  ],
  "limit": 5,
  "execution": "wand",
  "bmw_block_size": null,
  "return_stored": true,
  "highlight_field": "text"
}