{
  "query": "title:Mushrooms",
  "fields": null,
  "filters": [
    {
      "KeywordEq": {
        "field": "language",
        "value": "en"
      }
    },
    {
      "KeywordEq": {
        "field": "meal_type",
        "value": "dinner"
      }
    }
  ],
  "limit": 5,
  "execution": "wand",
  "bmw_block_size": null,
  "return_stored": true,
  "highlight_field": "text"
}